shop_id,shop_title,product_id,product_title,product_description_text,tags,storefront_product_url,first_image_url,all_image_urls,variant_count,variant_ids,variant_titles,min_variant_price_cents,max_variant_price_cents,visible,is_locked,blueprint_id,print_provider_id,created_at,updated_at
24436338,3iAtlas,68cf870d4a1cc466510fb857,3I/ATLAS Mystic Eye Wall Tapestry — Cosmic Symbol Art for Bedroom & Studio Decor,"Transform your wall into a focal point with the 3I/ATLAS Mystic Eye Wall Tapestry, a striking blend of cosmic symbolism, vibrant color, and surreal artistry. Featuring a hypnotic “all‑seeing eye” motif surrounded by planetary symbols and glowing neon accents, this tapestry brings mystical energy, wall‑worthy style, and immersive depth into any space. Key Features Bold Cosmic Design — Intricate “Mystic Eye” centerpiece encircled by celestial glyphs; neon purples, electric blues, and gold tones offer light & contrast for dramatic effect. Large Format & High‑Quality Print — Generously sized tapestry with crisp, fade‑resistant printing on premium fabric so the artwork retains detail and vibrancy. Easy Display & Versatile Décor — Lightweight material allows simple wall hanging (with clips, rods, or pushpins); ideal for bedrooms, dorms, studios, meditation spaces, or music‑video backdrops. Spiritual & Symbolic Appeal — The eye motif and surrounding symbols evoke themes of awareness, mysticism, vision, and cosmic connection. Giftable Art — Makes a perfect gift for lovers of spiritual art, cosmic design, or psychedelic visuals. Why Choose the 3I/ATLAS Mystic Eye Tapestry It isn’t just décor—it’s an experience. The design draws the viewer in and becomes a conversation piece in any room. Offers both aesthetic impact and practical size. Whether filling a large wall or anchoring a gallery layout, this tapestry holds its own. Texture and material quality ensure longevity; color‑safe print resists fading when cared for properly. Fits multiple styles: boho‑chic, cosmic, spiritual, mystic, psychedelic, or minimal with an edge. Care Instructions Hand‑wash or gentle machine wash cold; wash inside out to protect printed side Do not bleach Air dry flat or hang to dry If needed, iron on a low setting on reverse side, avoiding direct contact with printed artwork 104"" × 88"" Width, in 104.00 Lenght, in 88.00 Tolerance, in 2.50",,https://3iatlas.printify.me/product/23365981,https://images-api.printify.com/mockup/68cf870d4a1cc466510fb857/46151/2283/3iatlas-mystic-eye-wall-tapestry-cosmic-symbol-art-for-bedroom-studio-decor.jpg?camera_label=front,https://images-api.printify.com/mockup/68cf870d4a1cc466510fb857/46151/2283/3iatlas-mystic-eye-wall-tapestry-cosmic-symbol-art-for-bedroom-studio-decor.jpg?camera_label=front,8,41686|41687|45130|46151|46152|46153|46154|61899,"26"" × 36""|50"" × 60""|68"" × 80""|104"" × 88""|36"" × 26""|60"" × 50""|80"" × 68""|88"" × 104""",1900,5513,True,False,241,10,2025-09-21 05:03:09+00:00,2025-09-21 05:08:34+00:00
24436338,3iAtlas,68cf870a4a1cc466510fb854,3I/Atlas Alien Sublimation Socks: Interstellar Style for Earthlings,"3I/Atlas Alien Sublimation Socks : Interstellar Style for Earthlings Prepare for a fashion anomaly that transcends terrestrial trends! Introducing our exclusive 3I/Atlas Alien Sublimation Socks , crafted with patterns so mesmerizing, they're rumored to be sourced from an uncharted galaxy. These aren't just any colorful socks ; they're a visual transmission from the cosmos, bursting with vibrant hues of electric pink , deep space blue , nebula green , and cosmic orange . Designed for the adventurous spirit who believes style knows no earthly bounds, these otherworldly apparel pieces are truly in a league of their own, making them the ultimate choice for those seeking aliencore fashion . Embrace an aesthetic truly alien to this world, perfect for those who dare to defy the ordinary. Our futuristic socks feature a mind-bending, abstract pattern that swirls and shifts, creating an optical illusion that's both captivating and bold. They are the definitive accessory for championing unique socks and making a compelling statement . Whether you're navigating urban jungles or simply elevating your everyday ensemble, these vibrant crew socks promise to teleport your style to an entirely new dimension. Don the footwear of the cosmos and let your feet do the talking – or perhaps, the alien communicating.",,https://3iatlas.printify.me/product/23366355,https://images-api.printify.com/mockup/68cf870a4a1cc466510fb854/45133/53206/3iatlas-alien-sublimation-socks-interstellar-style-for-earthlings.jpg?camera_label=pose-1,https://images-api.printify.com/mockup/68cf870a4a1cc466510fb854/45133/53206/3iatlas-alien-sublimation-socks-interstellar-style-for-earthlings.jpg?camera_label=pose-1 | https://images-api.printify.com/mockup/68cf870a4a1cc466510fb854/45133/53209/3iatlas-alien-sublimation-socks-interstellar-style-for-earthlings.jpg?camera_label=all-sides | https://images-api.printify.com/mockup/68cf870a4a1cc466510fb854/45133/53212/3iatlas-alien-sublimation-socks-interstellar-style-for-earthlings.jpg?camera_label=left-front-and-back | https://images-api.printify.com/mockup/68cf870a4a1cc466510fb854/45133/53215/3iatlas-alien-sublimation-socks-interstellar-style-for-earthlings.jpg?camera_label=right-front-and-back,3,45132|45133|45134,L|M|S,853,853,True,False,376,1,2025-09-21 05:03:06+00:00,2025-09-21 05:36:29+00:00
24436338,3iAtlas,68cf870b4a1cc466510fb855,Beyond the Stars: The 3I/Atlas Astral Voyager Encounter Poster,"Beyond the Stars: The 3I/Atlas Astral Voyager Encounter Poster Unleash the awe of the cosmos with ""The Astral Voyager,"" a mesmerizing matte vertical poster that captures an extraordinary moment of interstellar connection. This vibrant artwork plunges you into a swirling vortex of deep blues and electric pinks, depicting a majestic astral voyager alien seemingly floating in a realm of mysterious plasma . With its multi-limbed form and luminous third eye, this ethereal being embodies ancient wisdom and boundless exploration, making it a powerful cosmic art statement piece for any space. Delve deeper into the narrative as this enigmatic entity, specifically an alien from 3I/Atlas – a celestial marvel often associated with Comet Atlas – embarks on a profound journey across the universe. The intricate background showcases distant galaxies and constellations, hinting at the vast distances traversed by this cosmic traveler . The artwork powerfully suggests a pivotal moment: an initial, perhaps cautious, glance at our world, foreshadowing an incredible extraterrestrial encounter with earthly humans . This piece is not just art; it's a window into a speculative future, a bridge between known reality and the profound mysteries of the unknown, ideal for collectors of sci-fi wall art and seekers of spiritual cosmic prints . Transform your living room, bedroom, or meditation space into a nexus of cosmic energy. This vibrant alien art is designed to spark conversations, inspire contemplation, and ignite the imagination of anyone captivated by the universe's grand narrative. It’s an exceptional gift for science fiction enthusiasts , UFO aficionados , and anyone who dreams of connections beyond our world. Let ""The Astral Voyager"" be your daily reminder of the infinite possibilities that lie within the cosmos and the potential for a wondrous human-alien interaction . Elevate your decor with a touch of the extraordinary.",,https://3iatlas.printify.me/product/23366031,https://images-api.printify.com/mockup/68cf870b4a1cc466510fb855/114557/106501/beyond-the-stars-the-3iatlas-astral-voyager-encounter-poster.jpg?camera_label=front,https://images-api.printify.com/mockup/68cf870b4a1cc466510fb855/114557/106501/beyond-the-stars-the-3iatlas-astral-voyager-encounter-poster.jpg?camera_label=front | https://images-api.printify.com/mockup/68cf870b4a1cc466510fb855/114557/106530/beyond-the-stars-the-3iatlas-astral-voyager-encounter-poster.jpg?camera_label=front-2 | https://images-api.printify.com/mockup/68cf870b4a1cc466510fb855/114557/106613/beyond-the-stars-the-3iatlas-astral-voyager-encounter-poster.jpg?camera_label=close-up | https://images-api.printify.com/mockup/68cf870b4a1cc466510fb855/114557/106562/beyond-the-stars-the-3iatlas-astral-voyager-encounter-poster.jpg?camera_label=context-1,13,114557|112749|101133|101127|101120|101119|101110|43150|43147|43144|43141|43138|43135,"8"" x 10"" / Matte|14"" x 14"" / Matte|18"" x 18"" / Matte|12"" x 12"" / Matte|16″ x 16″ / Matte|10″ x 10″ / Matte|12"" x 16"" / Matte|24″ x 36″ / Matte|20″ x 30″ / Matte|18″ x 24″ / Matte|16″ x 20″ / Matte|12″ x 18″ / Matte|11″ x 14″ / Matte",718,1925,True,False,282,99,2025-09-21 05:03:07+00:00,2025-09-21 05:12:15+00:00
24436338,3iAtlas,68cf870d4a1cc466510fb858,Blast Off to the Cosmos with the 3I/Atlas Galaxy Journey Phone Case!,"Blast Off to the Cosmos with the 3I/Atlas Galaxy Journey Phone Case! Prepare for launch with a phone case that captures the awe-inspiring moment the 3I/Atlas rocket ignites its engines, hurtling into the vast unknown. This isn't just a smartphone cover ; it's a vibrant portal to boundless adventure, depicting the magnificent spacecraft as it takes off into outerspace , setting a course toward our magnificent galaxy . The electrifying green exhaust plume and intricate, glowing cosmic ring design create a truly captivating futuristic aesthetic , making your device a beacon for all space exploration enthusiasts and dreamers of interstellar travel . Embrace your inner cosmic adventurer and let your device reflect your passion for the stars. Perfect for anyone who loves sci-fi design , epic journeys, and the mysteries of the universe , this unique tech accessory transforms your phone into a statement of ambition. Whether you're navigating urban jungles or charting digital frontiers, carry the spirit of a galaxy quest and the wonder of a neon rocket launch with you. Stand out from the crowd and show the world your journey is just beginning, wherever your mission takes you!",,https://3iatlas.printify.me/product/23365971,https://images-api.printify.com/mockup/68cf870d4a1cc466510fb858/112191/105690/blast-off-to-the-cosmos-with-the-3iatlas-galaxy-journey-phone-case.jpg?camera_label=front,https://images-api.printify.com/mockup/68cf870d4a1cc466510fb858/112191/105690/blast-off-to-the-cosmos-with-the-3iatlas-galaxy-journey-phone-case.jpg?camera_label=front | https://images-api.printify.com/mockup/68cf870d4a1cc466510fb858/112191/105731/blast-off-to-the-cosmos-with-the-3iatlas-galaxy-journey-phone-case.jpg?camera_label=close-up | https://images-api.printify.com/mockup/68cf870d4a1cc466510fb858/112191/105706/blast-off-to-the-cosmos-with-the-3iatlas-galaxy-journey-phone-case.jpg?camera_label=layers | https://images-api.printify.com/mockup/68cf870d4a1cc466510fb858/112191/105714/blast-off-to-the-cosmos-with-the-3iatlas-galaxy-journey-phone-case.jpg?camera_label=context | https://images-api.printify.com/mockup/68cf870d4a1cc466510fb858/112192/105691/blast-off-to-the-cosmos-with-the-3iatlas-galaxy-journey-phone-case.jpg?camera_label=front | https://images-api.printify.com/mockup/68cf870d4a1cc466510fb858/112192/105732/blast-off-to-the-cosmos-with-the-3iatlas-galaxy-journey-phone-case.jpg?camera_label=close-up | https://images-api.printify.com/mockup/68cf870d4a1cc466510fb858/112192/105707/blast-off-to-the-cosmos-with-the-3iatlas-galaxy-journey-phone-case.jpg?camera_label=layers | https://images-api.printify.com/mockup/68cf870d4a1cc466510fb858/112192/105715/blast-off-to-the-cosmos-with-the-3iatlas-galaxy-journey-phone-case.jpg?camera_label=context,154,61521|61522|61523|61524|61525|61526|61529|61530|61531|61532|61533|61534|61797|61798|61800|61801|61804|61805|63234|63235|63236|63237|63238|63239|65225|65226|65227|65228|65229|65230|67996|67997|67998|67999|68000|68001|68002|68003|75383|75384|75385|75386|75387|75388|75389|75390|77841|77842|77843|77844|77845|77846|79419|79420|79421|79422|79423|79424|79425|79426|80152|80153|80154|80155|80156|80157|96397|96398|96399|96400|96401|96402|96403|96404|96738|96739|96740|96741|96742|96743|98738|98739|98740|98741|102547|102548|102549|102550|102551|102552|102553|102554|105148|105149|105150|105151|105152|105153|105154|105155|105156|105157|112191|112192|112193|112194|112195|112196|112197|112198|116386|116387|116388|116389|116390|116391|116392|116393|116394|116395|116396|116397|116398|116399|116400|116401|116402|116403|116404|116405|116406|116407|116408|116409|116410|116411|116412|116413|116414|116415|117862|117863|117864|117865|117866|117867|129873|129874|129875|129876|129877|129878|129879|129880,iPhone 8 / Glossy|iPhone 8 / Matte|iPhone 8 Plus / Glossy|iPhone 8 Plus / Matte|iPhone X / Glossy|iPhone X / Matte|iPhone XR / Glossy|iPhone XR / Matte|iPhone XS / Glossy|iPhone XS / Matte|iPhone XS MAX / Glossy|iPhone XS MAX / Matte|Samsung Galaxy S10E / Glossy|Samsung Galaxy S10E / Matte|Samsung Galaxy S10 Plus / Glossy|Samsung Galaxy S10 / Glossy|Samsung Galaxy S10 Plus / Matte|Samsung Galaxy S10 / Matte|iPhone 11 / Glossy|iPhone 11 / Matte|iPhone 11 Pro / Glossy|iPhone 11 Pro / Matte|iPhone 11 Pro Max / Glossy|iPhone 11 Pro Max / Matte|Samsung Galaxy S20 / Glossy|Samsung Galaxy S20 / Matte|Samsung Galaxy S20 Ultra / Glossy|Samsung Galaxy S20 Ultra / Matte|Samsung Galaxy S20+ / Glossy|Samsung Galaxy S20+ / Matte|iPhone 12 Mini / Glossy|iPhone 12 Mini / Matte|iPhone 12 / Glossy|iPhone 12 / Matte|iPhone 12 Pro / Glossy|iPhone 12 Pro / Matte|iPhone 12 Pro Max / Glossy|iPhone 12 Pro Max / Matte|iPhone 13 / Glossy|iPhone 13 / Matte|iPhone 13 Mini / Glossy|iPhone 13 Mini / Matte|iPhone 13 Pro / Glossy|iPhone 13 Pro / Matte|iPhone 13 Pro Max / Glossy|iPhone 13 Pro Max / Matte|Samsung Galaxy S21 / Glossy|Samsung Galaxy S21 / Matte|Samsung Galaxy S21 Plus / Glossy|Samsung Galaxy S21 Plus / Matte|Samsung Galaxy S21 Ultra / Glossy|Samsung Galaxy S21 Ultra / Matte|Google Pixel 5 5G / Glossy|Google Pixel 5 5G / Matte|Google Pixel 6 / Glossy|Google Pixel 6 / Matte|Samsung Galaxy S20 FE / Glossy|Samsung Galaxy S20 FE / Matte|Samsung Galaxy S21 FE / Glossy|Samsung Galaxy S21 FE / Matte|Samsung Galaxy S22 / Glossy|Samsung Galaxy S22 / Matte|Samsung Galaxy S22 Plus / Glossy|Samsung Galaxy S22 Plus / Matte|Samsung Galaxy S22 Ultra / Glossy|Samsung Galaxy S22 Ultra / Matte|iPhone 14 / Glossy|iPhone 14 / Matte|iPhone 14 Pro / Glossy|iPhone 14 Pro / Matte|iPhone 14 Plus / Glossy|iPhone 14 Plus / Matte|iPhone 14 Pro Max / Glossy|iPhone 14 Pro Max / Matte|Samsung Galaxy S23 / Glossy|Samsung Galaxy S23 / Matte|Samsung Galaxy S23 Plus / Glossy|Samsung Galaxy S23 Plus / Matte|Samsung Galaxy S23 Ultra / Glossy|Samsung Galaxy S23 Ultra / Matte|Google Pixel 7 / Glossy|Google Pixel 7 / Matte|Google Pixel 6 Pro / Glossy|Google Pixel 6 Pro / Matte|iPhone 15 / Glossy|iPhone 15 / Matte|iPhone 15 Plus / Glossy|iPhone 15 Plus / Matte|iPhone 15 Pro / Glossy|iPhone 15 Pro / Matte|iPhone 15 Pro Max / Glossy|iPhone 15 Pro Max / Matte|Samsung Galaxy S24 / Glossy|Samsung Galaxy S24 / Matte|Samsung Galaxy S24 Plus / Glossy|Samsung Galaxy S24 Plus / Matte|Samsung Galaxy S24 Ultra / Glossy|Samsung Galaxy S24 Ultra / Matte|Google Pixel 8 Pro / Glossy|Google Pixel 8 Pro / Matte|Google Pixel 8 / Glossy|Google Pixel 8 / Matte|iPhone 16 / Glossy|iPhone 16 / Matte|iPhone 16 Plus / Glossy|iPhone 16 Plus / Matte|iPhone 16 Pro / Glossy|iPhone 16 Pro / Matte|iPhone 16 Pro Max / Glossy|iPhone 16 Pro Max / Matte|Google Pixel 9 / Glossy|Google Pixel 9 / Matte|Google Pixel 9 Pro / Glossy|Google Pixel 9 Pro / Matte|Google Pixel 9 Pro XL / Glossy|Google Pixel 9 Pro XL / Matte|Google Pixel 2 / Glossy|Google Pixel 2 / Matte|Google Pixel 2 XL / Glossy|Google Pixel 2 XL / Matte|Google Pixel 3 / Glossy|Google Pixel 3 / Matte|Google Pixel 3 XL / Glossy|Google Pixel 3 XL / Matte|Google Pixel 3a / Glossy|Google Pixel 3a / Matte|Google Pixel 3a XL / Glossy|Google Pixel 3a XL / Matte|Google Pixel 4 / Glossy|Google Pixel 4 / Matte|Google Pixel 4 XL / Glossy|Google Pixel 4 XL / Matte|Google Pixel 4a / Glossy|Google Pixel 4a / Matte|Google Pixel 4a 5G / Glossy|Google Pixel 4a 5G / Matte|Google Pixel / Glossy|Google Pixel / Matte|Google Pixel XL / Glossy|Google Pixel XL / Matte|Samsung Galaxy S25 / Glossy|Samsung Galaxy S25 / Matte|Samsung Galaxy S25 Plus / Glossy|Samsung Galaxy S25 Plus / Matte|Samsung Galaxy S25 Ultra / Glossy|Samsung Galaxy S25 Ultra / Matte|iPhone 17 / Glossy|iPhone 17 / Matte|iPhone 17 Air / Glossy|iPhone 17 Air / Matte|iPhone 17 Pro / Glossy|iPhone 17 Pro / Matte|iPhone 17 Pro Max / Glossy|iPhone 17 Pro Max / Matte,1788,1788,True,False,421,23,2025-09-21 05:03:09+00:00,2025-09-21 05:07:57+00:00
24436338,3iAtlas,68cf87054a1cc466510fb851,"Cosmic Alien Vertical Posters, Space Decor, Wall Art, Gift for Sci-Fi Lovers, Home Aesthetic, Unique Room Decoration","Welcome Aboard the 3I/Atlas: Your Interstellar Invitation Poster Prepare for an unforgettable cosmic rendezvous with our captivating ""Welcome Aboard the 3I/Atlas"" poster. This breathtaking piece of sci-fi wall art plunges you into a vibrant, ethereal universe, where two radiant extraterrestrial beings extend a warm, silent greeting to humanity. Bathed in a spectacular palette of electric purples, deep blues, and shimmering pinks, the scene unfolds against a mesmerizing nebula backdrop , seemingly from within the legendary 3I/Atlas spaceship itself. It’s more than just a poster; it’s an open invitation to embrace the future of galactic exploration and the profound beauty of interstellar friendship. This evocative futuristic art print is an absolute must-have for any space enthusiast , science fiction fan , or collector of unique home decor . Imagine this powerful statement piece transforming your gaming room decor , sparking conversation in a modern living space , or inspiring wonder in a dorm room or personal study. Its vibrant energy and welcoming aura evoke a sense of boundless possibility, reminding us that the universe is vast, full of discovery, and ready to greet us. Perfect for dreamers worldwide , this poster encapsulates the spirit of cosmic adventure, offering a daily dose of wonder for those who dare to look beyond the horizon. 11″ x 14″ 12"" x 16"" 12″ x 18″ 16″ x 20″ Width, in 11.00 12.00 12.00 16.00 Length, in 14.00 16.00 18.00 20.00",Home & Living|Matte|Indoor|Paper|Posters|Back to School|Valentine's Day promotion|Made in USA|Made in the USA|Assembled in USA|Assembled in the USA|US Elections Season,https://3iatlas.printify.me/product/23365946,https://images-api.printify.com/mockup/68cf87054a1cc466510fb851/43135/94677/cosmic-alien-vertical-posters-space-decor-wall-art-gift-for-sci-fi-lovers-home-aesthetic-unique-room-decoration.jpg?camera_label=front,https://images-api.printify.com/mockup/68cf87054a1cc466510fb851/43135/94677/cosmic-alien-vertical-posters-space-decor-wall-art-gift-for-sci-fi-lovers-home-aesthetic-unique-room-decoration.jpg?camera_label=front | https://images-api.printify.com/mockup/68cf87054a1cc466510fb851/43135/94718/cosmic-alien-vertical-posters-space-decor-wall-art-gift-for-sci-fi-lovers-home-aesthetic-unique-room-decoration.jpg?camera_label=front-2 | https://images-api.printify.com/mockup/68cf87054a1cc466510fb851/43135/99397/cosmic-alien-vertical-posters-space-decor-wall-art-gift-for-sci-fi-lovers-home-aesthetic-unique-room-decoration.jpg?camera_label=close-up | https://images-api.printify.com/mockup/68cf87054a1cc466510fb851/43135/95138/cosmic-alien-vertical-posters-space-decor-wall-art-gift-for-sci-fi-lovers-home-aesthetic-unique-room-decoration.jpg?camera_label=context-1 | https://images-api.printify.com/mockup/68cf87054a1cc466510fb851/101110/94682/cosmic-alien-vertical-posters-space-decor-wall-art-gift-for-sci-fi-lovers-home-aesthetic-unique-room-decoration.jpg?camera_label=front | https://images-api.printify.com/mockup/68cf87054a1cc466510fb851/101110/94723/cosmic-alien-vertical-posters-space-decor-wall-art-gift-for-sci-fi-lovers-home-aesthetic-unique-room-decoration.jpg?camera_label=front-2 | https://images-api.printify.com/mockup/68cf87054a1cc466510fb851/101110/99401/cosmic-alien-vertical-posters-space-decor-wall-art-gift-for-sci-fi-lovers-home-aesthetic-unique-room-decoration.jpg?camera_label=close-up | https://images-api.printify.com/mockup/68cf87054a1cc466510fb851/101110/95143/cosmic-alien-vertical-posters-space-decor-wall-art-gift-for-sci-fi-lovers-home-aesthetic-unique-room-decoration.jpg?camera_label=context-1 | https://images-api.printify.com/mockup/68cf87054a1cc466510fb851/43138/94683/cosmic-alien-vertical-posters-space-decor-wall-art-gift-for-sci-fi-lovers-home-aesthetic-unique-room-decoration.jpg?camera_label=front | https://images-api.printify.com/mockup/68cf87054a1cc466510fb851/43138/94724/cosmic-alien-vertical-posters-space-decor-wall-art-gift-for-sci-fi-lovers-home-aesthetic-unique-room-decoration.jpg?camera_label=front-2 | https://images-api.printify.com/mockup/68cf87054a1cc466510fb851/43138/99402/cosmic-alien-vertical-posters-space-decor-wall-art-gift-for-sci-fi-lovers-home-aesthetic-unique-room-decoration.jpg?camera_label=close-up | https://images-api.printify.com/mockup/68cf87054a1cc466510fb851/43138/95144/cosmic-alien-vertical-posters-space-decor-wall-art-gift-for-sci-fi-lovers-home-aesthetic-unique-room-decoration.jpg?camera_label=context-1 | https://images-api.printify.com/mockup/68cf87054a1cc466510fb851/43141/94692/cosmic-alien-vertical-posters-space-decor-wall-art-gift-for-sci-fi-lovers-home-aesthetic-unique-room-decoration.jpg?camera_label=front | https://images-api.printify.com/mockup/68cf87054a1cc466510fb851/43141/94730/cosmic-alien-vertical-posters-space-decor-wall-art-gift-for-sci-fi-lovers-home-aesthetic-unique-room-decoration.jpg?camera_label=front-2 | https://images-api.printify.com/mockup/68cf87054a1cc466510fb851/43141/99407/cosmic-alien-vertical-posters-space-decor-wall-art-gift-for-sci-fi-lovers-home-aesthetic-unique-room-decoration.jpg?camera_label=close-up | https://images-api.printify.com/mockup/68cf87054a1cc466510fb851/43141/95149/cosmic-alien-vertical-posters-space-decor-wall-art-gift-for-sci-fi-lovers-home-aesthetic-unique-room-decoration.jpg?camera_label=context-1,13,114557|112749|101133|101127|101120|101119|101110|43150|43147|43144|43141|43138|43135,"8"" x 10"" / Matte|14"" x 14"" / Matte|18"" x 18"" / Matte|12"" x 12"" / Matte|16″ x 16″ / Matte|10″ x 10″ / Matte|12"" x 16"" / Matte|24″ x 36″ / Matte|20″ x 30″ / Matte|18″ x 24″ / Matte|16″ x 20″ / Matte|12″ x 18″ / Matte|11″ x 14″ / Matte",718,1925,True,False,282,99,2025-09-21 05:03:01+00:00,2025-09-21 05:05:54+00:00
